link,question_number,flores_passage,question,mc_answer1,mc_answer2,mc_answer3,mc_answer4,correct_answer_num,dialect,ds
https://en.wikinews.org/wiki/Explosion_at_earthquake-damaged_Fukushima_nuclear_power_plant,2,گزارش‌های تلویزیونی حاکی از وجود دود سفید بر فراز کارخانه است. مقامات محلی به ساکنین همسایگی نیروگاه هشدار می‌دهند که در خانه بمانند،‌ تهویه هوا را خاموش کنند و آب شیر ننوشند. بر اساس آژانس هسته‌ای ژاپن، سزیم و ید رادیواکتیو در این نیروگاه یافت شده است. مقامات حدس می‌زنند این نشان دهنده آن است که مخازن سوخت اورانیم در این تاسیسات ممکن است خراب شده و در حال نشت کردن هستند.,کدام یک از موارد زیر هشدار ایمنی توصیه‌شده به ساکنان محلی پس از حادثه در کارخانه نیست؟,اجتناب از استفاده از دستگاه‌های تهویه هوا,ماندن داخل خانه,اجتناب از تنفس گاز سفید,اجتناب از نوشیدن آب شیر,3,pes_Arab,2023-06-07
https://en.wikinews.org/wiki/Extremely_drug-resistant_tuberculosis_strain_emerges_in_South_Africa,1,"دکتر تونی مول موفق شد سل بسیار مقاوم به دارو (XDR-TB) را در منطقه کوازولو-ناتال در آفریقای جنوبی کشف کند. او در مصاحبه‌ای گفت که گونه جدید «بسیار دردسرساز و نگران‌کننده بود زیرا نرخ مرگ و میر خیلی بالایی داشت.» دکتر مول فکر می کند که برخی از بیماران ممکن است در بیمارستان با ساس داشته باشند، و حداقل دو نفر از آنها کارمندان بهداشت بیمارستان بودند. در مدت یک سال، ‌یک شخص مبتلا شده ممکن است 10 تا 15 نفر از کسانی که تماس نزدیک داشته‌اند را مبتلا کند. با وجود این، درصد XDR-TB در کل گروه افراد مبتلا به سل هنوز به نظر کم می‌رسد؛ 6,000 مورد ابتلا از کل 330,000 در یک لحظه خاص در آفریقای جنوبی.",به گفته دکتر مول، چه چیزی درباره XDR-TB بیشتر نگران‌کننده است؟,گونه جدید سرایت‌یافته در بیمارستان,مقاومت گونه به داروها,تعداد افرادی که یک شخص دچار عفونت می‌تواند مبتلا کند,میزان مرگ و میر بالای آن,4,pes_Arab,2023-06-07
https://en.wikinews.org/wiki/Extremely_drug-resistant_tuberculosis_strain_emerges_in_South_Africa,2,"دکتر تونی مول موفق شد سل بسیار مقاوم به دارو (XDR-TB) را در منطقه کوازولو-ناتال در آفریقای جنوبی کشف کند. او در مصاحبه‌ای گفت که گونه جدید «بسیار دردسرساز و نگران‌کننده بود زیرا نرخ مرگ و میر خیلی بالایی داشت.» دکتر مول فکر می کند که برخی از بیماران ممکن است در بیمارستان با ساس داشته باشند، و حداقل دو نفر از آنها کارمندان بهداشت بیمارستان بودند. در مدت یک سال، ‌یک شخص مبتلا شده ممکن است 10 تا 15 نفر از کسانی که تماس نزدیک داشته‌اند را مبتلا کند. با وجود این، درصد XDR-TB در کل گروه افراد مبتلا به سل هنوز به نظر کم می‌رسد؛ 6,000 مورد ابتلا از کل 330,000 در یک لحظه خاص در آفریقای جنوبی.",چه تعداد از بیمارانی که به سویه جدید مبتلا شده بودند، تأیید شد که کادر درمان بوده‌اند؟,10,2,15,1,2,pes_Arab,2023-06-07
https://en.wikibooks.org/wiki/Accordion/Right_hand,1,دقت کنید که حین زدن درست همه نوت‌ها، دستتان تا جای ممکن رها باشد - همچنین سعی کنید زیاد حرکت اضافه با انگشتان خود انجام ندهید. به این ترتیب، خود را تا حد امکان کمتر خسته خواهید کرد. به یاد داشته باشید که برای حجم صدای بیشتر نیازی نیست به مانند پیانو با نیروی بیشتری کلیدها را فشار دهید. در آکاردئون، برای رسیدن به صدای بیشتر، از نعره با فشار یا سرعت بیشتر استفاده می کنید.,با توجه به متن، کدام مورد نکته‌ای صحیح برای نواختن موفقیت‌آمیز آکاردئون محسوب نمی‌شود؟,برای حجم صدای بیشتر، نیروی بیشتری روی کلیدها وارد کنید,برای حفظ وضعیت خود، حرکات غیر ضروری را به حداقل برسانید,نسبت به نواختن نت‌ها هشیار باشد و در عین حال دست را راحت بگیرید,برای رسیدن به حجم صدای بیشتر، سرعت اجرای نعره را افزایش دهید,1,pes_Arab,2023-06-07
https://en.wikibooks.org/wiki/Accordion/Right_hand,2,دقت کنید که حین زدن درست همه نوت‌ها، دستتان تا جای ممکن رها باشد - همچنین سعی کنید زیاد حرکت اضافه با انگشتان خود انجام ندهید. به این ترتیب، خود را تا حد امکان کمتر خسته خواهید کرد. به یاد داشته باشید که برای حجم صدای بیشتر نیازی نیست به مانند پیانو با نیروی بیشتری کلیدها را فشار دهید. در آکاردئون، برای رسیدن به صدای بیشتر، از نعره با فشار یا سرعت بیشتر استفاده می کنید.,هنگام نواختن آکاردئون، کدام یک از موارد زیر به افزایش صدا کمک می‌کند؟,سرعت بیشتر,نیروی بیشتر,فشار کمتر,حرکت انگشت کمتر,1,pes_Arab,2023-06-07
https://en.wikibooks.org/wiki/All_About_Converting_From_Several_Video_Formats_To_DVD,1,یکی از شایع‌ترین مشکلات هنگام تبدیل کردن فیلم به قالب DVD بیرون زدن تصویر از کادر است. اکثر تلویزیون‌ها طوری ساخته شده‌است که مورد پسند مردم باشد. به آن دلیل، هر آنچه در تلویزیون مشاهده می‌کنید، کناره‌هایش از بالا، پایین و دو طرف برش خورده است. این برای اطمینان از آن ساخته شده تا تصویر به درستی در کل صفحه نمایش داده می‌شود. به آن overscan گفته می‌شود. متأسفانه وقتی یک DVD می‌سازید، کناره‌هایش نیز به احتمال زیاد از کادر خارج می‌شود و اگر زیرنویس این ویدئو به پایین تصویر خیلی نزدیک باشد، کامل نشان داده نمی‌شوند.,چرا کناره تصاویر در تلویزیون برش خورده می‌شود؟,برای ایجاد امکان زیرنویس نوشتن,برای اینکه تصویر با کل صفحه تطبیق پیدا کند,برای ایجاد امکان تبدیل ساده به فرمت‌های دیگر,برای بیش از اندازه نزدیک به پایین برش خوردن زیرنویس‌ها,2,pes_Arab,2023-06-07
https://en.wikibooks.org/wiki/All_About_Converting_From_Several_Video_Formats_To_DVD,2,یکی از شایع‌ترین مشکلات هنگام تبدیل کردن فیلم به قالب DVD بیرون زدن تصویر از کادر است. اکثر تلویزیون‌ها طوری ساخته شده‌است که مورد پسند مردم باشد. به آن دلیل، هر آنچه در تلویزیون مشاهده می‌کنید، کناره‌هایش از بالا، پایین و دو طرف برش خورده است. این برای اطمینان از آن ساخته شده تا تصویر به درستی در کل صفحه نمایش داده می‌شود. به آن overscan گفته می‌شود. متأسفانه وقتی یک DVD می‌سازید، کناره‌هایش نیز به احتمال زیاد از کادر خارج می‌شود و اگر زیرنویس این ویدئو به پایین تصویر خیلی نزدیک باشد، کامل نشان داده نمی‌شوند.,با توجه به متن، هنگام تبدیل فیلم به فرمت DVD ممکن است با کدام یک از مشکلات زیر مواجه شوید؟,تصویری که با کل صفحه تطابق ندارد,زیرنویس‌هایی که به طور نسبی برش خورده است,تصویری که کل صفحه را پر می‌کند,کناره‌های برش خورده,2,pes_Arab,2023-06-07
https://en.wikibooks.org/wiki/American_Revolution/The_Battles_of_Trenton_and_Princeton,2,طرح آمریکایی‌ها روی اجرای حملاتی هماهنگ از سه جهت مختلف اتکا کرده بود. ژنرال جان کادوالدر یک حمله انحرافی را علیه پادگان انگلیسی واقع در بوردرتاون آغاز کرد تا مسیر هرگونه نیروی کمکی را مسدود کند. ژنرال جیمز اوینگ 700 شبه‌نظامی را به رودخانه واقع در «ترنتون فری» برد، پل روی «اسانپینک کریک» را محاصره کرد و از فرار کردن نیروهای دشمن جلوگیری نمود. نیروی اصلی حمله 2400 نفری در نه مایلی شمال ترنتون از رودخانه عبور کرده و سپس برای شروع حمله پیش از طلوع آفتاب به دو گروه، یکی تحت رهبری گرین و دیگری تحت رهبری سالیوان، تقسیم می شود.,پادگان انگلیسی در کجا واقع شده بود؟,«اسانپینک کریک»,ترنتون,بوردرتاون,پرینستون,3,pes_Arab,2023-06-07
https://en.wikibooks.org/wiki/American_Revolution/The_Declaration_of_Independence,1,پس از تصویب آن توسط کنگره در چهارم ژوئیه، یک پیش‌نویس خطی با امضای جان هنکاک، رِئیس کنگره، و چارلز تامسون، منشی، به چاپخانه جان دانلپ که چند بلوک با آنجا فاصله داشت فرستاده شد. در طول شب بین 150 تا 200 نسخه ایجاد شد، که اکنون به عنوان «اعلامیه Dunlap» شناخته می‌شود. جان نیکسون کسی بود که سند را برای اولین بار روز 8 ژوئیه در حضور عموم و در حیاط «سالن استقلال» قرائت کرد. در ششم ژوئیه یک رونوشت برای جرج واشنگتن ارسال شد که در نهم ژوئیه دستور داد برای سربازانش در نیویورک بخوانند. در دهم آگوست یک رونوشت به لندن رسید. پهنه دانلاپ 25 هنوز وجود دارد و قدیمی‌ترین نسخه‌های بازمانده از این سند است. نسخه دست‌نویس اصلی باقی نمانده است.,امضای چه کسی در پیش‌نویس خطی وجود داشت؟,جان دانلپ,جرج واشنگتن,جان نیکسون,چارلز تامسون,4,pes_Arab,2023-06-07
https://en.wikibooks.org/wiki/American_Revolution/The_Declaration_of_Independence,2,پس از تصویب آن توسط کنگره در چهارم ژوئیه، یک پیش‌نویس خطی با امضای جان هنکاک، رِئیس کنگره، و چارلز تامسون، منشی، به چاپخانه جان دانلپ که چند بلوک با آنجا فاصله داشت فرستاده شد. در طول شب بین 150 تا 200 نسخه ایجاد شد، که اکنون به عنوان «اعلامیه Dunlap» شناخته می‌شود. جان نیکسون کسی بود که سند را برای اولین بار روز 8 ژوئیه در حضور عموم و در حیاط «سالن استقلال» قرائت کرد. در ششم ژوئیه یک رونوشت برای جرج واشنگتن ارسال شد که در نهم ژوئیه دستور داد برای سربازانش در نیویورک بخوانند. در دهم آگوست یک رونوشت به لندن رسید. پهنه دانلاپ 25 هنوز وجود دارد و قدیمی‌ترین نسخه‌های بازمانده از این سند است. نسخه دست‌نویس اصلی باقی نمانده است.,«اعلامیه Dunlap» به کدام یک از مکان‌های زیر آخر از همه رسید؟,نیویورک,چاپخانه دانلپ,لندن,سالن استقلال,3,pes_Arab,2023-06-07
https://en.wikibooks.org/wiki/American_Revolution/Ticonderoga_and_Bunker_Hill,1,استعمارگران نیز با مشاهده این فعالیت تقاضای نیروهای کمکی کردند. نیروهایی که ماموریت تقویت مواضع رو به جلو را داشتند، دسته اول و سوم نیوهمپشایر با استعداد 200 مرد به فرماندهی سرهنگ جان استارک و جیمز رید (که هر دو بعدا ژنرال شدند) بودند. افراد «استارک» در طول حصار در قسمت انتهای شمالی موقعیت کلونیست‌ها مستقر شدند. هنگامی که جزر و مد خفیف وقفه‌ای در امتداد رودخانه میستیک در امتداد شمال شرقی شبه جزیره ایجاد کرد، آن‌ها به سرعت حصار را با یک دیوار سنگی کوتاه به سمت شمال گسترش دادند که انتهای آن در لبه آب در ساحل کوچکی قرار گرفت. «گریدلی»‌ و «استارک» یک تیرک چوبی حدود 100 فوتی (30 متری) در جلوی حصار قرار دادند و دستور دادند تا زمانی که نیروهای معمولی از آن عبور نکرده‌اند شلیک نکنند.,افراد لشکر سرهنگ «استارک» در کجا مستقر شدند؟,در طول حصار در قسمت انتهای شمالی,در امتداد آب‌های ساحلی,در امتداد شمال شرقی شبه‌جزیره,در مقابل حصار,1,pes_Arab,2023-06-07
https://en.wikibooks.org/wiki/American_Revolution/Ticonderoga_and_Bunker_Hill,2,استعمارگران نیز با مشاهده این فعالیت تقاضای نیروهای کمکی کردند. نیروهایی که ماموریت تقویت مواضع رو به جلو را داشتند، دسته اول و سوم نیوهمپشایر با استعداد 200 مرد به فرماندهی سرهنگ جان استارک و جیمز رید (که هر دو بعدا ژنرال شدند) بودند. افراد «استارک» در طول حصار در قسمت انتهای شمالی موقعیت کلونیست‌ها مستقر شدند. هنگامی که جزر و مد خفیف وقفه‌ای در امتداد رودخانه میستیک در امتداد شمال شرقی شبه جزیره ایجاد کرد، آن‌ها به سرعت حصار را با یک دیوار سنگی کوتاه به سمت شمال گسترش دادند که انتهای آن در لبه آب در ساحل کوچکی قرار گرفت. «گریدلی»‌ و «استارک» یک تیرک چوبی حدود 100 فوتی (30 متری) در جلوی حصار قرار دادند و دستور دادند تا زمانی که نیروهای معمولی از آن عبور نکرده‌اند شلیک نکنند.,با توجه به متن، افراد «استارک» چه زمانی حصار خود را گسترش دادند؟,هنگامی که استعمارگران تقاضای نیروهای کمکی کردند,پس از اینکه نیروهای معمولی از تیرک عبور کردند,هنگام جزر و مد,هنگامی که نیروها مواضع رو به جلو داشتند,3,pes_Arab,2023-06-07
https://en.wikibooks.org/wiki/Ancient_China/Government,1,چین باستان روش منحصربه‌فردی برای نشان دادن دوره‌های زمانی مختلف داشت؛ هر دوره زمانی از چین یا هر خانواده که قدرت را در دست داشت یک سلسله متمایز بود. همچنین بین هر سلسله، یک عصر ناپایدار وجود داشت که استانها تقسیم می‌شدند. معروف‌ترین دوره، دوران سه پادشاهی بود که به مدت 60 سال بین‌ سلسله هان و جین اتفاق افتاد. در این دوران، جنگ‌های شدیدی بین بسیاری از اشراف که برای تاج و تخت می‌جنگیدند، صورت گرفت. این سه پادشاهی یکی از خونین‌ترین دوران تاریخ چین باستان به حساب می‌آید که در آن هزاران نفر برای تصاحب بالاترین کرسی در کاخ بزرگ در شی‌آن جان خود را از دست دادند.,با توجه به متن، کدام‌‌یک از موارد زیر از خشونت‌بارترین دوره‌های چین بوده است؟,سلسله جین,دوره شی‌آن,سلسله هان,دوران سه پادشاهی,4,pes_Arab,2023-06-07
"https://en.wikibooks.org/wiki/Animal_Behavior/Army_Ants_-_Social_Hierarchy,_Life_Cycles,_and_Migration",1,کلونی‌های مورچه‌های شکارچی نیز به گونه‌های مختلف لشکرکشی و لانه‌سازی می‌کنند. در مرحله عشایری، مورچه‌های سرباز، شبانه راهپیمایی می‌کنند و در طول روز برای برپایی اردوگاه توقف می‌کنند. مرحله زندگی عشایری زمانی آغاز می‌شود که غذای موجود کلونی کاهش یافته باشد. در این مرحله، کلونی لانه‌های موقتی ایجاد می‌کند که هر روز تغییر می‌کنند. هریک از این تاخت‌وتازها یا راهپیمایی‌های مهاجرتی تقریباً‌ 17 روز طول می‌کشد.,با توجه به متن، کدام مورد درباره ورود کلونی مورچه‌های شکارچی به مرحله عشایری صدق می‌کند؟,در طول شب لانه‌سازی می‌کنند,ذخیره غذای کمی دارند,لانه‌هایی می‌سازند که پس از 17 روز تغییر می‌کنند,در طول روز راهپیمایی می‌کنند,2,pes_Arab,2023-06-07
"https://en.wikibooks.org/wiki/Animal_Behavior/Army_Ants_-_Social_Hierarchy,_Life_Cycles,_and_Migration",2,کلونی‌های مورچه‌های شکارچی نیز به گونه‌های مختلف لشکرکشی و لانه‌سازی می‌کنند. در مرحله عشایری، مورچه‌های سرباز، شبانه راهپیمایی می‌کنند و در طول روز برای برپایی اردوگاه توقف می‌کنند. مرحله زندگی عشایری زمانی آغاز می‌شود که غذای موجود کلونی کاهش یافته باشد. در این مرحله، کلونی لانه‌های موقتی ایجاد می‌کند که هر روز تغییر می‌کنند. هریک از این تاخت‌وتازها یا راهپیمایی‌های مهاجرتی تقریباً‌ 17 روز طول می‌کشد.,با توجه به متن، کدام عبارت عادات لانه‌سازی کلونی‌های مورچه‌های شکارچی را در مرحله عشایری به طور دقیق نشان می‌دهد؟,آنها در طی شب لانه‌سازی می‌کنند,به مدت 17 روز بدون لانه‌سازی راهپیمایی می‌کنند,به طور روزانه لانه‌ها را عوض می‌کنند,در طی این مرحله، از همان لانه‌ها استفاده می‌کنند,3,pes_Arab,2023-06-07
https://en.wikivoyage.org/wiki/Travelling_around_the_Schengen_Area,1,اروپا قاره‌ای نسبتاً کوچک است ولی در آن کشورهای مستقل زیادی وجود دارد. تحت شرایط عادی،‌ سفر کردن بین کشورهای متعدد مستلزم چندین بار طی کردن فرآیندهای درخواست ویزا و کنترل گذرنامه است. با این حال، منطقه شنگن از این لحاظ مثل یک کشور عمل می‌کند. تا زمانی که در این منطقه اقامت دارید، عموماً می‌توانید بدون گذشتن مجدد از محل بازرسی گذرنامه، از مرزها عبور کنید. به همین ترتیب، با داشتن ویزای شینگن، دیگر نیازی به درخواست ویزا برای هر یک از کشورهای عضو شینگن به طور جداگانه نیست، از این رو در وقت، پول و کاغذ بازی صرفه جویی می کنید.,کدام‌یک از موارد زیر یک مزیت سفر در منطقه شینگن است؟,اجتناب از درخواست‌های متعدد ویزا,صرفه‌جویی در پول,اجتناب از ایست‌های متعدد بازرسی کنترل گذرنامه,بدون الزام گذرنامه,3,pes_Arab,2023-06-07
https://en.wikivoyage.org/wiki/Valley_of_the_Kings,1,مقبره «توتنخامن» (KV62). احتمالاً KV62 مشهورترین مقبره‌ در این درّه است، جایی که «هاوارد کارتر» در سال 1922 تدفین سلطنتی پادشاه جوان را تقریباً دست نخورده کشف کرد. با این وجود در مقایسه با بسیاری از مقبره‌های سلطنتی دیگر، مقبره توت‌عنخ‌آمون بسیار کوچک‌تر است و تزئینات محدودی دارد به همین خاطر به سختی ارزش دیدن دارد. هرکسی که علاقه‌مند است شواهد آسیب وارد شده به مومیایی در حین خارج کردنش از تابوت را مشاهده کند، ناامید می‌شود زیرا فقط سر و شانه‌ها قابل مشاهده هستند. ثروت‌های شگفت انگیز این مقبره دیگر درون آن قرار ندارد، بلکه به موزه مصر در قاهره برده شده است. بازدید کنندگانی زمان محدودی دارند، بهتر است وقت خود را در جای دیگری صرف کنند.,چه چیزی را دیگر نمی‌تواند در مقبره توت‌عَنخ‌آمون یافت؟,برخی تزئینات,سر مومیایی,شانه‌های مومیایی,ثروت‌ها,4,pes_Arab,2023-06-07
https://en.wikivoyage.org/wiki/Vancouver,1,جزیره بووین شامل یک سفر یک روزه دوست‌داشتنی یا گردش آخر هفته است که قایق‌رانی، پیاده‌روی، رستوران و غیره ارائه می‌کند. این جامعه بااصالت در دریاراه Howe در کنار ونکوور واقع شده است، و به‌راحتی می‌توان طبق برنامه با تاکسی‌های دریایی که از جزیره گرنویل در پایین شهر ونکوور حرکت می‌کنند به آنجا دسترسی یافت. برای آنهایی که به فعالیت‌های فضای باز علاقه دارند، پیاده‌روی با گذر از دالان Seak to Sky واجب است. ویسلر (با فاصله 1.5 ساعت رانندگی از ونکور) گران است ولی بخاطر المپیک زمستان 2010 شهرت دارد. در زمستان، از کمی اسکی در آمریکای شمالی لذت ببرید، و در تابستان کمی دوچرخه‌سواری بصورت مطمئن در کوهستان را امتحان کنید.,مطابق با متن، کدام‌یک از مقصدهای ونکوور کمترین میزان جذابیت را برای مسافران نگران قیمت دارد؟ ,جزیره گرنویل,دالان Sea to Sky,جزیر بووین,ویسلر,4,pes_Arab,2023-06-07
