link,question_number,flores_passage,question,mc_answer1,mc_answer2,mc_answer3,mc_answer4,correct_answer_num,dialect,ds
https://en.wikinews.org/wiki/Mumbai_2008_attack_plotter_sentenced_to_35_years,2,مهاجمان بمبئی روز 26 نوامبر 2008 با قایق رسیدند و در حالی که با خود نارنجک و سلاح‌های اتوماتیک آورده بودند، اهداف متعددی را نشانه رفتند، از جمله ایستگاه راه‌آهن پرازدحام Chhatrapati Shivaji Terminus و هتل مشهور تاج محل. پیشاهنگی و جمع‌آوری اطلاعات توسط دیوید هدلی به فعال کردن 10 فرد مسلح از گروه شبه نظامی پاکستان لشکر طیبه کمک کرده است. این حمله باعث تنش زیادی در روابط بین هندوستان و پاکستان شد.,گروه شبه‌نظامی از چه نوع وسیله نقلیه‌ای برای سفر به بمبئی استفاده کرد؟,راه‌آهن,هواپیما,قایق,ماشین,3,pes_Arab,2023-06-07
https://en.wikinews.org/wiki/Nadal_beats_Raonic_to_reach_Australian_Open_semis,1,رکورد امتیاز نادال در مقابل حریف کانادایی 7–2 است. او به تازگی در مسابقات اوپن Brisbane، مقابل رائونیک نتیجه را واگذار کرد. نادال در این مسابقه 88٪ امتیازات تور را از آن خود کرد و در ست اول، 76 امتیاز گرفت. پس از مسابقه، «سلطان زمین‌های رسی» گفت: «من از بازگشت دوباره به دور نهایی این رویداد بسیار مهم خیلی خوشحالم. من برای بردن اینجا هستم.»,کدام عبارت ذکر شده در متن به‌طور دقیق بازتاب نتیجه مسابقه اوپن نادال و رائونیک در Brisbane است؟,رائونیک دربرابر نادال پیروز شد,رائونیک امتیاز خالص ‎88% داشت,نادال دربرابر رائونیک پیروز شد,رائونیک امتیاز 76 کسب کرد,1,pes_Arab,2023-06-07
https://en.wikinews.org/wiki/Nadal_beats_Raonic_to_reach_Australian_Open_semis,2,رکورد امتیاز نادال در مقابل حریف کانادایی 7–2 است. او به تازگی در مسابقات اوپن Brisbane، مقابل رائونیک نتیجه را واگذار کرد. نادال در این مسابقه 88٪ امتیازات تور را از آن خود کرد و در ست اول، 76 امتیاز گرفت. پس از مسابقه، «سلطان زمین‌های رسی» گفت: «من از بازگشت دوباره به دور نهایی این رویداد بسیار مهم خیلی خوشحالم. من برای بردن اینجا هستم.»,مطابق با متن، جایگاه نادال و رائونیک در مسابقه پس از اولین سرویس چه بود؟,رائونیک امتیاز خالص ‎88% داشت,نادال با امتیاز 76 برنده شد,امتیاز ‎7-2 بود,رائونیک دربرابر نادال پیروز شد,2,pes_Arab,2023-06-07
https://en.wikinews.org/wiki/Naked_News_to_create_international_language_editions,1,هفته گذشته خبرگزاری Naked News اعلام کرد که مدت زمان برنامه گزارش‌دهی خبری به زبان‌های بین‌المللی را با سه برنامه جدید به‌طور چشمگیری افزایش خواهد داد. این سازمان جهانی که هم‌اکنون به دو زبان انگلیسی و ژاپنی گزارش می‌دهد، درحال راه‌اندازی برنامه‌های اسپانیایی، ایالیایی و کره‌ای برای تلویزیون، اینترنت و دستگاه‌های همراه است.,کدام برنامه زبانی در سه پخش رسانه‌ای جدید Naked News آورده نمی‌شود؟,ایتالیایی,کره‌ای,ژاپنی,اسپانیایی,3,pes_Arab,2023-06-07
https://en.wikinews.org/wiki/Naked_News_to_create_international_language_editions,2,هفته گذشته خبرگزاری Naked News اعلام کرد که مدت زمان برنامه گزارش‌دهی خبری به زبان‌های بین‌المللی را با سه برنامه جدید به‌طور چشمگیری افزایش خواهد داد. این سازمان جهانی که هم‌اکنون به دو زبان انگلیسی و ژاپنی گزارش می‌دهد، درحال راه‌اندازی برنامه‌های اسپانیایی، ایالیایی و کره‌ای برای تلویزیون، اینترنت و دستگاه‌های همراه است.,مطابق با متن، پخش‌های رسانه‌ای جدید Naked News در کجا قابل دسترس نخواهد بود؟,تلفن‌های همراه,اینترنت,سالن‌های سینما و تئاتر,تلویزیون,3,pes_Arab,2023-06-07
https://en.wikinews.org/wiki/Nathalie_Carpanedo_finishes_wild_card_run_at_2013_IPC_Alpine_World_Championships,1,پس از مسابقه چهارشنبه، کارپاندو در دو مسابقه انفرادی در مسابقات قهرمانی رقابت کرد. نخستین حضور او در اسکی مارپیچ کوچک بود، جایی‌که وی موفق نشد به خط پایان برسد. 36 نفر از 116 رقیب او در آن مسابقه نتیجه مشابهی بدست آوردند. او در مسابقه دیگرش در Giant Slalom با مدت زمان ترکیبی 4:41.30 کار خود را در رتبه دهم در گروه نشسته بانوان پایان داد، که 2:11.60 دقیقه کندتر از کلودیا لوئیز اتریشی بود که مقام اول را از آن خود کرد و 1:09.02 دقیقه کندتر از مقام نهم که به Gyöngyi Dani از مجارستان رسید. چهار اسکی‌باز در گروه نشسته زنان نتوانستند مسیرشان را به اتمام برسانند و 45 نفر از کل 117 اسکی‌باز مارپیچ بزرگ نتوانستند در مسابقه رتبه کسب کنند.,چند رقیب اسکی مارپیچ بزرگ را به پایان نرساندند؟,36,117,4,45,3,pes_Arab,2023-06-07
https://en.wikinews.org/wiki/Nathalie_Carpanedo_finishes_wild_card_run_at_2013_IPC_Alpine_World_Championships,2,پس از مسابقه چهارشنبه، کارپاندو در دو مسابقه انفرادی در مسابقات قهرمانی رقابت کرد. نخستین حضور او در اسکی مارپیچ کوچک بود، جایی‌که وی موفق نشد به خط پایان برسد. 36 نفر از 116 رقیب او در آن مسابقه نتیجه مشابهی بدست آوردند. او در مسابقه دیگرش در Giant Slalom با مدت زمان ترکیبی 4:41.30 کار خود را در رتبه دهم در گروه نشسته بانوان پایان داد، که 2:11.60 دقیقه کندتر از کلودیا لوئیز اتریشی بود که مقام اول را از آن خود کرد و 1:09.02 دقیقه کندتر از مقام نهم که به Gyöngyi Dani از مجارستان رسید. چهار اسکی‌باز در گروه نشسته زنان نتوانستند مسیرشان را به اتمام برسانند و 45 نفر از کل 117 اسکی‌باز مارپیچ بزرگ نتوانستند در مسابقه رتبه کسب کنند.,کدام‌یک از عبارات زیر به‌طور دقیق نشان‌دهنده نتایج رقابت‌های مسابقات قهرمانی است؟,در رقابت دوم، کارپاندو قبل از یک اسکی‌باز از مجارستان به خط پایان رسید,45 اسکی‌باز مسیر خود را در اسکی مارپیچ بزرگ تمام نکردند.,اسکی‌بازهای بیشتری اسکی مارپیچ بزرگ را نسبت به اسکی مارپیچ کوچک به پایان رساندند.,کارپاندو در اسکی بزرگ دهم شد,3,pes_Arab,2023-06-07
https://en.wikinews.org/wiki/National_Basketball_Association_suspends_season_due_to_COVID-19_concerns,1,روز چهارشنبه، اتحادیه ملی بسکتبال ایالات متحده (NBA) به دلیل نگرانی در مورد کووید-19، فصل بسکتبال حرفه‌ای خود را به حالت تعلیق درآورد. تصمیم NBA به دنبال آزمایش مثبت ویروس کووید-19 بازیکن یوتا جاز بود.,NBA تصمیم به تعلیق کدام مورد زیر گرفت؟,فصل بسکتبال,یک بازیکن از یوتا جاز,هر بازیکنی که تست کووید-19 او مثبت شد,تیم بسکتبال یوتا جاز,1,pes_Arab,2023-06-07
https://en.wikinews.org/wiki/National_Basketball_Association_suspends_season_due_to_COVID-19_concerns,2,روز چهارشنبه، اتحادیه ملی بسکتبال ایالات متحده (NBA) به دلیل نگرانی در مورد کووید-19، فصل بسکتبال حرفه‌ای خود را به حالت تعلیق درآورد. تصمیم NBA به دنبال آزمایش مثبت ویروس کووید-19 بازیکن یوتا جاز بود.,مطابق متن، چه چیز سبب نگرانی‌های NBA درخصوص این ویروس شد؟,تست اعضای NBA مثبت شد,تست چند نفر از بازیکن‌ها در بازی یوتا جاز مثبت شد,یکی از بازیکن‌های یوتا جاز پس از مثبت شدن تست عملکرد نامطلوب داشت,تست یکی از بازیکن‌های یوتا جاز مثبت شد,4,pes_Arab,2023-06-07
"https://en.wikinews.org/wiki/National_Hockey_League_news:_March_22,_2008",1,بازیکن منتخب امروز، الکس اوچکین از Washington Capitals است. او در برد 5-3 واشینگتن مقابل «آتلانتا تراشرز» 2 گل زد و 2 پاس گل داد. پاس گل اوچکین در آن شب موجب گل پیروزی‌ بخشی شد که توسط نیکلاس بکستروم تازه‌کار زده شد. دومین گل آن شب او شصتمین گل فصلش بود، و بدین ترتیب اولین بازیکنی شد که بعد از سال 96-1995، زمانی که جارومیر جاگر و ماریو لمیوکس هرکدام به آن رکورد دست یافتند، حداقل 60 گل در یک فصل به ثمر رسانده است.,چه کسی گل برنده بازی برای Washington Capitals را در بازی در مقابل آتلانتا تراشرز به ثمر رساند؟,نیکلاس بکستروم,جارومیر جاگر,ماریو لمیوکس,الکس اوچکین,1,pes_Arab,2023-06-07
"https://en.wikinews.org/wiki/National_Hockey_League_news:_March_22,_2008",2,بازیکن منتخب امروز، الکس اوچکین از Washington Capitals است. او در برد 5-3 واشینگتن مقابل «آتلانتا تراشرز» 2 گل زد و 2 پاس گل داد. پاس گل اوچکین در آن شب موجب گل پیروزی‌ بخشی شد که توسط نیکلاس بکستروم تازه‌کار زده شد. دومین گل آن شب او شصتمین گل فصلش بود، و بدین ترتیب اولین بازیکنی شد که بعد از سال 96-1995، زمانی که جارومیر جاگر و ماریو لمیوکس هرکدام به آن رکورد دست یافتند، حداقل 60 گل در یک فصل به ثمر رسانده است.,چه کسی گل شصتم فصل را در طول بازی Capitals درمقابل تراشرز به ثمر رساند؟,ماریو لمیوکس,جارومیر جاگر,الکس اوچکین,نیکلاس بکستروم,3,pes_Arab,2023-06-07
https://en.wikinews.org/wiki/Nationalised_bank_Northern_Rock_sold_to_Virgin_Money,1,پس از آنکه دریافت حمایت اضطراری از دولت انگلستان افشا شد، بانک Northern Rock در سال 2008 ملی اعلام شد. مؤسسه Northern Rock به دلیل تأثیرپذیری‌اش طی دوره بحران وام‌های بدون پشتوانه در سال 2007، نیازمند کمک و پشتیبانی شده بود. گروه ویرجین مربوط به سر ریچارد برانسون پیش از ملی شدن این بانک، پیشنهادی برای آن ارائه کرده بود که رد شد. در سال 2010، بانک سهامی عام Northern Rock که اکنون بانک خیابان اصلی است و ملی شده است، از «بانک بد» یعنی Northern Rock (مدیریت دارایی‌ها) جدا شد. ویرجین فقط آن هویت «بانک خوبِ» Northern Rock را خریده است، نه شرکت مدیریت دارایی را.,بانک Northern Rock چه زمانی نیاز به حمایت از دولت داشت؟,پس از اینکه بانک ملی شد,زمانی‌که بانک از شرکت مدیریت دارایی جدا شد,پس از اینکه گروه ویرجین بانک را خریداری کرد,درطول بحران وام‌دهی,4,pes_Arab,2023-06-07
https://en.wikinews.org/wiki/Nationalised_bank_Northern_Rock_sold_to_Virgin_Money,2,پس از آنکه دریافت حمایت اضطراری از دولت انگلستان افشا شد، بانک Northern Rock در سال 2008 ملی اعلام شد. مؤسسه Northern Rock به دلیل تأثیرپذیری‌اش طی دوره بحران وام‌های بدون پشتوانه در سال 2007، نیازمند کمک و پشتیبانی شده بود. گروه ویرجین مربوط به سر ریچارد برانسون پیش از ملی شدن این بانک، پیشنهادی برای آن ارائه کرده بود که رد شد. در سال 2010، بانک سهامی عام Northern Rock که اکنون بانک خیابان اصلی است و ملی شده است، از «بانک بد» یعنی Northern Rock (مدیریت دارایی‌ها) جدا شد. ویرجین فقط آن هویت «بانک خوبِ» Northern Rock را خریده است، نه شرکت مدیریت دارایی را.,مطابق با متن، کدام عبارات زیر دقیقاً معاملات گروه ویرجین را با بانک Northern Rock توصیف می‌کند؟,گروه ویرجین همچنین شرکت مدیریت دارایی Northern Rock را خریداری کرد,گروه ویرجین این بانک را پس از ملی شدن آن خریداری کرد,گروه ویرجین درطول بحران وام‌دهی حمایت اضطراری بانکی ارائه کرد,اولین سفارش گروه ویرجین برای بانک پس از ملی شدن بانک انجام گرفت,2,pes_Arab,2023-06-07
https://en.wikinews.org/wiki/New_Australian_Prime_Minister_signs_Kyoto,1,تصمیم آقای رود مبنی بر امضای معاهده آب‌وهوایی کیوتو باعث تفکیک ایالات متحده می‌شود، کشوری که اکنون تنها کشور توسعه‌یافته‌ای است که توافق‌نامه را به رسمیت نمی‌شناسد. دولت محافظه کار قبلی استرالیا از مجوز دادن به کیوتو خودداری کرد و گفت که این کار به اقتصاد با تکیه زیاد به صادرات ذغال‌سنگ آسیب می‌رساند در حالیکه کشورهایی مانند هندوستان و چین مقید به اهداف کاهش گازهای گل‌خانه‌ای نبودند.,همان‌طور که در متن بیان شد، کدام ملت تحت تأثیر امضای معاهده آب‌وهوایی کیوتو است؟,ایالات متحده,هندوستان,استرالیا,چین,1,pes_Arab,2023-06-07
https://en.wikinews.org/wiki/New_Australian_Prime_Minister_signs_Kyoto,2,تصمیم آقای رود مبنی بر امضای معاهده آب‌وهوایی کیوتو باعث تفکیک ایالات متحده می‌شود، کشوری که اکنون تنها کشور توسعه‌یافته‌ای است که توافق‌نامه را به رسمیت نمی‌شناسد. دولت محافظه کار قبلی استرالیا از مجوز دادن به کیوتو خودداری کرد و گفت که این کار به اقتصاد با تکیه زیاد به صادرات ذغال‌سنگ آسیب می‌رساند در حالیکه کشورهایی مانند هندوستان و چین مقید به اهداف کاهش گازهای گل‌خانه‌ای نبودند.,دولت قبلی استرالیا فکر می‌کرد تصویب معاهده کیوتو به چه چیز آسیب خواهد رساند؟,ایالات متحده,اقتصاد کشور,صادرات ذغال‌سنگ,اهداف کاهش انتشار گازهای گلخانه‌ای کشور,2,pes_Arab,2023-06-07
https://en.wikinews.org/wiki/New_South_Wales_government_starts_trial_of_hunting_in_national_parks,1,تیراندازان شرکت کننده در آزمایش کنترل آفات مکمل باید به دقت توسط جنگلبانان نظارت می‌شدند، زیرا این آزمایش تحت نظارت بود و میزان موثر بودن آن مورد ارزیابی قرار گرفت. با همکاری NPWS و انجمن تیراندازان ورزشکار استرالیا (NSW) با هم، افراد داوطلب واجد شرایط تحت برنامه شکار انجمن تیراندازان ورزشکار استخدام شدند. به گفته Mick O'Flynn، مدیر حفاظت از پارک و میراث با NPWS، چهار تیرانداز انتخاب شده برای اولین عملیات تیراندازی، دستورالعمل جامع ایمنی و آموزش را دریافت کردند.,تیراندازها در میدان تیر در کدام برنامه استخدام شدند؟,برنامه انجمن تیراندازان ورزشکار استرالیا,برنامه حفاظت از پارک و میراث,برنامه NPWS,برنامه شکار انجمن تیراندازان ورزشکار,4,pes_Arab,2023-06-07
https://en.wikinews.org/wiki/New_South_Wales_government_starts_trial_of_hunting_in_national_parks,2,تیراندازان شرکت کننده در آزمایش کنترل آفات مکمل باید به دقت توسط جنگلبانان نظارت می‌شدند، زیرا این آزمایش تحت نظارت بود و میزان موثر بودن آن مورد ارزیابی قرار گرفت. با همکاری NPWS و انجمن تیراندازان ورزشکار استرالیا (NSW) با هم، افراد داوطلب واجد شرایط تحت برنامه شکار انجمن تیراندازان ورزشکار استخدام شدند. به گفته Mick O'Flynn، مدیر حفاظت از پارک و میراث با NPWS، چهار تیرانداز انتخاب شده برای اولین عملیات تیراندازی، دستورالعمل جامع ایمنی و آموزش را دریافت کردند.,کدام عبارت به‌طور دقیق بازتاب آزمایش کنترل آفات نیست؟,از آنجایی‌که اولین آزمایش برنامه بود، ارزیابی نشده بود.,تیراندازها دستورالعمل آموزش دریافت کردند,تیراندازها تحت نظارت رنجرها بودند,چهار تیرانداز انتخاب شدند,1,pes_Arab,2023-06-07
https://en.wikinews.org/wiki/New_fossils_from_10_million_year_old_ape_found_in_Ethiopia,1,«براساس این فسیل، بدان معنی است که شکاف بسیار زودتر از آنچه توسط شواهد مولکولی پیش‌بینی شده، اتفاق افتاده است.» Berhane Asfaw محقق سرویس تحقیقاتی Rift Valley و یکی از نویسندگان این تحقیق در اتیوپی گفت: «این بدان معناست که همه چیز باید پس‌گرفته شود.»,مطابق با متن، شکاف در کجا پیدا شد؟,در Rift Valley,در فسیل,در شواهد ملکولی,در اتیوپی,2,pes_Arab,2023-06-07
https://en.wikinews.org/wiki/New_fossils_from_10_million_year_old_ape_found_in_Ethiopia,2,«براساس این فسیل، بدان معنی است که شکاف بسیار زودتر از آنچه توسط شواهد مولکولی پیش‌بینی شده، اتفاق افتاده است.» Berhane Asfaw محقق سرویس تحقیقاتی Rift Valley و یکی از نویسندگان این تحقیق در اتیوپی گفت: «این بدان معناست که همه چیز باید پس‌گرفته شود.»,مطابق با متن، چه چیز زودتر از انتظار رخ داد؟,اکتشاف فسیل,شکاف,تجزیه شواهد ملکولی,تحقیق در Rift Valley,2,pes_Arab,2023-06-07
https://en.wikinews.org/wiki/Nintendo_unveils_controller_for_Revolution_console,1,در جلسه ارائه راهبردی نمایشگاه بازی‌های توکیو در روز پنجشنبه، رئیس شرکت نینتندو آقای «ساترو ایواتا» از طراحی دسته کنسول «Nintendo Revolution» که کنسول جدید این شرکت است رونمایی کرد. این کنترلر شبیه به ریموت کنترل تلویزیون است و از دو سنسور که در نزدیکی تلویزیون کاربر قرار داده شده و علم مثلثات برای تعیین موقعیت خود در فضای سه بعدی استفاده می‌کند. این به بازیکنان امکان خواهد داد تا اقدامات و حرکت‌ها را در بازی‌های ویدئویی توسط حرکت دستگاه در هوا کنترل کنند.,بازیکن به چه چیزی نیاز خواهد داشت تا حرکات را درطول یک بازی ویدئویی کنترل کند؟,اطمینان از اینکه سنسورهای کنترلر نزدیک کنسول قرار گیرند,مثلثی کردن موقعیت آنها,قرار دادن سنسورها نزدیک تلویزیون,حرکت دادن کنترلر در هوا,4,pes_Arab,2023-06-07
https://en.wikinews.org/wiki/Nintendo_unveils_controller_for_Revolution_console,2,در جلسه ارائه راهبردی نمایشگاه بازی‌های توکیو در روز پنجشنبه، رئیس شرکت نینتندو آقای «ساترو ایواتا» از طراحی دسته کنسول «Nintendo Revolution» که کنسول جدید این شرکت است رونمایی کرد. این کنترلر شبیه به ریموت کنترل تلویزیون است و از دو سنسور که در نزدیکی تلویزیون کاربر قرار داده شده و علم مثلثات برای تعیین موقعیت خود در فضای سه بعدی استفاده می‌کند. این به بازیکنان امکان خواهد داد تا اقدامات و حرکت‌ها را در بازی‌های ویدئویی توسط حرکت دستگاه در هوا کنترل کنند.,چه چیز طراحی شد که شبیه یک ریموت کنترل تلویزیون باشد؟,دو سنسور کنترلر,کنترلر Nintendo Revolution,معرفی keynote,کنسول Nintendo Revolution,2,pes_Arab,2023-06-07
"https://en.wikinews.org/wiki/No_bomb_threat,_hijacking_of_plane_in_China%27s_Xinjiang_region_according_to_Afghan_officials",1,پیش از این خبرگزاری چینی شینهووا از ربوده شدن هواپیما خبر داده بود. گزارشات بعدی بیان کرد که هواپیما تهدید بمب‌گذاری داشته است و با تغییر مسیر به سمت افغانستان، در قندهار نشسته است. گزارشات اولیه بیان می‌دارد که هواپیما پس از اینکه اجازه فرود اضطراری در اورومچی به آن داده نشده به افغانستان بازگشته بود.,چه چیز در آخرین گزارش از آژانس خبری شینهووا بیان نشد؟,هواپیما یک تهدید بمب‌گذاری دریافت کرد,هواپیما در اورومچی فرود آمد,مسیر هواپیما به سمت افغانستان عوض شد,هواپیما در قندهار فرود آمد,2,pes_Arab,2023-06-07
"https://en.wikinews.org/wiki/No_bomb_threat,_hijacking_of_plane_in_China%27s_Xinjiang_region_according_to_Afghan_officials",2,پیش از این خبرگزاری چینی شینهووا از ربوده شدن هواپیما خبر داده بود. گزارشات بعدی بیان کرد که هواپیما تهدید بمب‌گذاری داشته است و با تغییر مسیر به سمت افغانستان، در قندهار نشسته است. گزارشات اولیه بیان می‌دارد که هواپیما پس از اینکه اجازه فرود اضطراری در اورومچی به آن داده نشده به افغانستان بازگشته بود.,چه چیز در گزارش اولیه آژانس خبری جدید شینهووا گزارش نشد؟,هواپیما ربوده شد,اجازه فرود اضطراری هواپیما رد شد,هواپیما از مسیر خارج شد و به سمت افغانستان رفت,هواپیما یک تهدید بمب‌گذاری دریافت کرد,4,pes_Arab,2023-06-07
