link,question_number,flores_passage,question,mc_answer1,mc_answer2,mc_answer3,mc_answer4,correct_answer_num,dialect,ds
https://en.wikinews.org/wiki/Australian_treasurer_enters_nuclear_debate,1,پیتر کاستلو، خزانه دار استرالیایی و مردی که به احتمال زیاد به عنوان رهبر حزب لیبرال جانشین نخست وزیر جان هاوارد می‌شود، از صنعت انرژی هسته ای در استرالیا حمایت کرده است. آقای کاستلو گفت که وقتی تولید انرژی هسته ای از نظر اقتصادی مناسب شود، استرالیا استفاده از آن را باید دنبال کند. «اگر به صورت تجاری درآید، باید آن‌را داشته باشیم. آقای کاستلو گفت، هیچ اعتراض اصولی نسبت به انرژی هسته‌ای» وجود ندارد.,رهبر حزب لیبرال استرالیا کیست؟,پیتر کاستلو,جان هاوارد,جان کر,مالکولم فراسر,2,pes_Arab,2023-06-07
https://en.wikinews.org/wiki/Australian_treasurer_enters_nuclear_debate,2,پیتر کاستلو، خزانه دار استرالیایی و مردی که به احتمال زیاد به عنوان رهبر حزب لیبرال جانشین نخست وزیر جان هاوارد می‌شود، از صنعت انرژی هسته ای در استرالیا حمایت کرده است. آقای کاستلو گفت که وقتی تولید انرژی هسته ای از نظر اقتصادی مناسب شود، استرالیا استفاده از آن را باید دنبال کند. «اگر به صورت تجاری درآید، باید آن‌را داشته باشیم. آقای کاستلو گفت، هیچ اعتراض اصولی نسبت به انرژی هسته‌ای» وجود ندارد.,چرا استرالیا پیش از این صنعت انرژی هسته‌ای نداشته است؟,عدم پشتیبانی عمومی,بیش از اندازه جنجالی بودن,بیش از اندازه خطرناک بودن,بیش از اندازه گران بودن,4,pes_Arab,2023-06-07
https://en.wikinews.org/wiki/Austria_leads_medal_count_after_second_day_of_2013_IPC_Alpine_World_Championships,1,از آنجایی که فقط هجده مدال در روز وجود دارد، بسیاری از کشورها نتوانسته‌اند به سکوی قهرمانی دست یابند. از جمله این کشورها هلند است، چنان‌که آنا جاشمسن دیروز در کلاس زنان در اسکی مارپیچ سرعت نهم شد و فنلاند با کاتجا سارینن که در همان مسابقه دهم شد. میچل گورلی استرالیایی در رقابت‌های اسکی مارپیچ سرعت نشسته مردان به مقام یازدهم رسید. اولدریچ ژلینک، رقیب چک او در رقابت‌های اسکی مارپیچ سرعت نشسته مردان در مکان شانزدهم قرار گرفت. آرلی ولاسکز از مکزیک به مقام پانزدهم اسکی Super-G نشسته مردان رسید. آدام هال نیوزلندی به مقام نهم اسکی Super-G ایستاده رسید. ماسیج کرزل اسکی‌باز مرد لهستانی که معلولیت بینایی داشت بود و راهنمای او آنا اوگارزینسکا اسکی مارپیچ سرعت را در جایگاه سیزدهم به پایان رساندند. پارک سئورک جونگ از کره‌جنوبی مسابقات اسکی مارپیچ سرعت نشسته مردان را با مقام بیست و چهارمی به پایان رساند.,کدام اسکی باز با کمک راهنما مسابقه داد؟,آنا جاشمسن,پارک سئورک جونگ,ماسیج کرزل,آنا اوگارزینسکا,3,pes_Arab,2023-06-07
https://en.wikinews.org/wiki/Austria_leads_medal_count_after_second_day_of_2013_IPC_Alpine_World_Championships,2,از آنجایی که فقط هجده مدال در روز وجود دارد، بسیاری از کشورها نتوانسته‌اند به سکوی قهرمانی دست یابند. از جمله این کشورها هلند است، چنان‌که آنا جاشمسن دیروز در کلاس زنان در اسکی مارپیچ سرعت نهم شد و فنلاند با کاتجا سارینن که در همان مسابقه دهم شد. میچل گورلی استرالیایی در رقابت‌های اسکی مارپیچ سرعت نشسته مردان به مقام یازدهم رسید. اولدریچ ژلینک، رقیب چک او در رقابت‌های اسکی مارپیچ سرعت نشسته مردان در مکان شانزدهم قرار گرفت. آرلی ولاسکز از مکزیک به مقام پانزدهم اسکی Super-G نشسته مردان رسید. آدام هال نیوزلندی به مقام نهم اسکی Super-G ایستاده رسید. ماسیج کرزل اسکی‌باز مرد لهستانی که معلولیت بینایی داشت بود و راهنمای او آنا اوگارزینسکا اسکی مارپیچ سرعت را در جایگاه سیزدهم به پایان رساندند. پارک سئورک جونگ از کره‌جنوبی مسابقات اسکی مارپیچ سرعت نشسته مردان را با مقام بیست و چهارمی به پایان رساند.,کدام کشور در مسابقات Super-G کلاس ایستاده زنان دهم شد؟,فنلاند,هلند,استرالیا,مکزیک,1,pes_Arab,2023-06-07
https://en.wikinews.org/wiki/BBC_newsreader_sacked_after_conviction_for_wounding_teenager,1,محاکمه در دادگاه کراون برمینگام انجام گرفت و روز 3 آگوست مختومه اعلام شد. اخبارگویی که در صحنه جرم بازداشت شد منکر حمله شد و مدعی شد که از تیرک برای دفاع از خود در برابر بطری‌هایی که توسط بیش از سی نفر به سوی او پرتاب شده دفاع کرده است. «بلیک» همچنین بخاطر تلاش برای منحرف کردن مسیر دادرسی محکوم گردید. قاضی به «بلیک» گفت که «تقریباً اجتناب‌ناپذیر» است و او قرار است به زندان فرستاده شود.,با توجه به متن، کدام جمله درباره بلیک صحیح نیست؟,در صحنه جرم دستگیر شد,به حمله اعتراف کرد,هنگام حمله از یک میله استفاده کرد,مدعی شد که به سمت او بطری پرتاب شده است,2,pes_Arab,2023-06-07
https://en.wikinews.org/wiki/BBC_newsreader_sacked_after_conviction_for_wounding_teenager,2,محاکمه در دادگاه کراون برمینگام انجام گرفت و روز 3 آگوست مختومه اعلام شد. اخبارگویی که در صحنه جرم بازداشت شد منکر حمله شد و مدعی شد که از تیرک برای دفاع از خود در برابر بطری‌هایی که توسط بیش از سی نفر به سوی او پرتاب شده دفاع کرده است. «بلیک» همچنین بخاطر تلاش برای منحرف کردن مسیر دادرسی محکوم گردید. قاضی به «بلیک» گفت که «تقریباً اجتناب‌ناپذیر» است و او قرار است به زندان فرستاده شود.,بر اساس متن، کدام یک از موارد زیر برای بلیک اتفاق نیفتاد؟,او به دلیل نقض عدالت مجرم شناخته شد,وی دستگیر شد,با یک میله به او حمله شد,به او گفته شد که احتمالاً به زندان می‌رود,3,pes_Arab,2023-06-07
https://en.wikinews.org/wiki/Bali_climate_change_conference_begins,1,سایر مباحث موجود در بالی شامل نجات جنگل‌های باقیمانده جهان، و به اشتراک گذاری فناوری‌هایی برای کمک به کشور‌های در حال توسعه به شیوه هایی است که آلایندگی کمتری ایجاد کنند. سازمان ملل همچنین امیدوار است برای کمک به کشورهایی که تحت تاثیر گرمایش کره زمین قرار گرفته اند، بودجه‌ای را نهایی کند تا بتواند با این اثرات مقابله کند. این پول می‌تواند به سمت خانه‌های ضد سیل، مدیریت بهتر آب و تنوع زراعی برود.,بودجه گرمایش جهانی سازمان ملل برای چه چیزی به کار نمی‌رود؟,تنوع زراعی,آوردن فناوری به کشورهای در حال توسعه,خانه‌های مقاوم در برابر سیل,کاهش اثرات گرمایش زمین,2,pes_Arab,2023-06-07
https://en.wikinews.org/wiki/Bali_climate_change_conference_begins,2,سایر مباحث موجود در بالی شامل نجات جنگل‌های باقیمانده جهان، و به اشتراک گذاری فناوری‌هایی برای کمک به کشور‌های در حال توسعه به شیوه هایی است که آلایندگی کمتری ایجاد کنند. سازمان ملل همچنین امیدوار است برای کمک به کشورهایی که تحت تاثیر گرمایش کره زمین قرار گرفته اند، بودجه‌ای را نهایی کند تا بتواند با این اثرات مقابله کند. این پول می‌تواند به سمت خانه‌های ضد سیل، مدیریت بهتر آب و تنوع زراعی برود.,با توجه به متن، سازمان ملل متحد امید دارد که چه چیزی را نجات دهد؟,پول، از طریق اشتراک فناوری,محصولات,بقایای جنگل‌های بارانی,مردمی که تحت تاثیر مدیریت ضعیف آب قرار گرفته‌اند,3,pes_Arab,2023-06-07
"https://en.wikinews.org/wiki/Benin,_Nigeria_join_African_Union_continental_free_trade_bloc",1,نیجریه پیش‌تر اعلام کرد قصد داشت در هفته منتهی به اجلاس، به منطقه آزاد تجاری قاره آفریقا (AfCFTA) ملحق شود. «آلبرت موچانگا»، کمیسیونر صنعت و تجارت اتحادیه آفریقا، اعلام کرد بنین قرار است ملحق شود. کمیسر گفت، «ما هنوز در مورد قوانین مبداء و امتیازات تعرفه‌ای توافق نکرده‌ایم، اما چارچوبی که در اختیار داریم برای شروع تجارت از 1 ژوئیه 2020 کافی است.»,کدام مورد توسط «آلبرت موچانگا» به عنوان موضوعی که هنوز نیاز به توافق داشت، ذکر نشده است؟,اینکه آیا بنین به AfCTA ملحق خواهد شد,تاریخی که تجارت می‌تواند شروع شود,قوانین مبداء,امتیازات تعرفه‌ای ,1,pes_Arab,2023-06-07
"https://en.wikinews.org/wiki/Benin,_Nigeria_join_African_Union_continental_free_trade_bloc",2,نیجریه پیش‌تر اعلام کرد قصد داشت در هفته منتهی به اجلاس، به منطقه آزاد تجاری قاره آفریقا (AfCFTA) ملحق شود. «آلبرت موچانگا»، کمیسیونر صنعت و تجارت اتحادیه آفریقا، اعلام کرد بنین قرار است ملحق شود. کمیسر گفت، «ما هنوز در مورد قوانین مبداء و امتیازات تعرفه‌ای توافق نکرده‌ایم، اما چارچوبی که در اختیار داریم برای شروع تجارت از 1 ژوئیه 2020 کافی است.»,با توجه به متن،‌ چرا شروع تجارت از ماه ژوئیه امکانپذیر است؟,تاریخ شروع در ژوئیه بخشی از شرایط نیجریه برای پیوستن به AfCFTA بود,چارچوب کافی برای قوانین و امتیازات وجود دارد,توسط کمیسر تجارت و صنعت AU تأیید شد ,بر سر قوانین مبداء و امتیازات تعرفه‌ای توافق شده است,2,pes_Arab,2023-06-07
"https://en.wikinews.org/wiki/Beverly_Hall,_indicted_public_school_superintendent,_dies_aged_68",1,او در زمان اقامت در آتلانتا تحسین منتقدان را برانگیخت و به دلیل آموزش شهری نوآورانه شناخته شد. در سال 2009، عنوان «ناظر ملی سال» به او اختصاص یافت. در زمان اهدای جایزه، مدارس آتلانتا شاهد پیشرفت بزرگی در نمرات آزمون‌ها بودند. نه‌چندان بعد، آتلانتا ژورنال-کانستیتیوشن گزارشی منتشر کرد که نشان می‌داد آزمایش‌ها مشکلاتی دارند. این گزارش نشان می‌دهد که نمرات آزمون به طور غیرموجه سریع افزایش یافته است، و ادعا می‌شود مدرسه مشکلات داخلی را کشف کرده اما براساس یافته‌ها عمل نکرده است. شواهد بعد از آن حاکی از دستکاری مدارک آزمایشی توسط هال و 34 مقام آموزشی دیگر است که در 2013 محاکمه شده‌اند.,بر اساس این متن، آتلانتا ژورنال-کانستیتیوشن مقامات آموزش و پرورش را به چه چیزی متهم کرد؟,دستکاری در گزارش ژورنال-کانستیتیوشن,عدم نوآوری در آموزش شهری,عدم رسیدگی به مشکلات داخلی شناسایی شده,گزارش نمرات آزمون پایین,3,pes_Arab,2023-06-07
"https://en.wikinews.org/wiki/Beverly_Hall,_indicted_public_school_superintendent,_dies_aged_68",2,او در زمان اقامت در آتلانتا تحسین منتقدان را برانگیخت و به دلیل آموزش شهری نوآورانه شناخته شد. در سال 2009، عنوان «ناظر ملی سال» به او اختصاص یافت. در زمان اهدای جایزه، مدارس آتلانتا شاهد پیشرفت بزرگی در نمرات آزمون‌ها بودند. نه‌چندان بعد، آتلانتا ژورنال-کانستیتیوشن گزارشی منتشر کرد که نشان می‌داد آزمایش‌ها مشکلاتی دارند. این گزارش نشان می‌دهد که نمرات آزمون به طور غیرموجه سریع افزایش یافته است، و ادعا می‌شود مدرسه مشکلات داخلی را کشف کرده اما براساس یافته‌ها عمل نکرده است. شواهد بعد از آن حاکی از دستکاری مدارک آزمایشی توسط هال و 34 مقام آموزشی دیگر است که در 2013 محاکمه شده‌اند.,با توجه به متن، چه چیزی در گزارش آتلانتا ژورنال-کانستیتیوشن ذکر نشده است؟,بهبود غیرعادی نمرات آزمون,شواهدی مبنی بر دستکاری برگه‌های آزمون,برنده بهترین مدیر ملی سال 2013,پیشنهادهایی برای نوآوری آموزش شهری,1,pes_Arab,2023-06-07
https://en.wikinews.org/wiki/Bomb_blasts_kill_several_in_Iran,1,یک بمب در بیرون دفتر فرماندار کل منفجر شد. سه بمب دیگر در یک بازه دو ساعته نزدیک ساختمان‌های دولت منفجر شد. برخی گزارش‌های رسمی تعداد کشته شدگان را هشت نفر اعلام می‌کنند و گزارش‌های رسمی زخمی شدن 30 تن را تایید می‌کند؛ اما اعداد نهایی هنوز مشخص نیست.,با توجه به متن، چه اطلاعاتی از این بمباران در دست است؟,شمار نهایی تلفات,بمب‌ها در نزدیکی کدام ساختمان‌ها منفجر شدند,اینکه آیا قرار بود بمب‌های بیشتری منفجر شود ,گزارش‌های رسمی آمار کشتگان,2,pes_Arab,2023-06-07
https://en.wikinews.org/wiki/Brazilian_footballer_Gabriel_Jesus_signs_contract_extension_with_Manchester_City,1,«عیسی» 21 ساله در سال گذشته در ژانویه 2017 از باشگاه برزیلی پالمیراس طبق گزارش با دستمزد 27 میلیون پوند به منچستر سیتی ملحق شد. از آن زمان، بازیکن برزیلی در 53 مسابقه در تمام رقابت‌های باشگاه حضور برجسته‌ای داشت و 24 گل زد.,عیسی از زمان پیوستن به منچسترسیتی در سال 2017، در چند بازی شرکت کرده است؟,24,21,27,53,4,pes_Arab,2023-06-07
https://en.wikinews.org/wiki/Brazilian_footballer_Gabriel_Jesus_signs_contract_extension_with_Manchester_City,2,«عیسی» 21 ساله در سال گذشته در ژانویه 2017 از باشگاه برزیلی پالمیراس طبق گزارش با دستمزد 27 میلیون پوند به منچستر سیتی ملحق شد. از آن زمان، بازیکن برزیلی در 53 مسابقه در تمام رقابت‌های باشگاه حضور برجسته‌ای داشت و 24 گل زد.,عیسی برای پیوستن به کدام باشگاه مبلغ 27 میلیون پوند دریافت کرد؟,پالمیراس,منچستر سیتی,کروزیرو,منچستر یونایتد,2,pes_Arab,2023-06-07
https://en.wikinews.org/wiki/Building_collapses_in_Mecca_at_eve_of_Hajj_pillgrimage,1,یک پانسیون در مکه، شهر مقدس اسلام، حدود ساعت 10 امروز صبح به وقت محلی فرو ریخت. ساختمانی که شماری از زائرها در آن ساکن بودند و برای زیارت شهر مقدس در روز قبل از زیارت حج رسیده بودند. مهمانان هتل اغلب از شهروندان امارات متحده عربی بودند. آمار کشته‌ها حداقل 15 نفر است و انتظار می‌رود که افزایش یابد.,کدام جمله درباره مهمانان هاستل درست نیست؟,مهمانان برای زیارت در مکه بودند,برخی از مهمانان شهروندان محلی نبودند,مهمانان روز قبل زیارت حج آنجا بودند,اکثریت مهمانان از شهر مقدس بودند,4,pes_Arab,2023-06-07
https://en.wikinews.org/wiki/Building_collapses_in_Mecca_at_eve_of_Hajj_pillgrimage,2,یک پانسیون در مکه، شهر مقدس اسلام، حدود ساعت 10 امروز صبح به وقت محلی فرو ریخت. ساختمانی که شماری از زائرها در آن ساکن بودند و برای زیارت شهر مقدس در روز قبل از زیارت حج رسیده بودند. مهمانان هتل اغلب از شهروندان امارات متحده عربی بودند. آمار کشته‌ها حداقل 15 نفر است و انتظار می‌رود که افزایش یابد.,با توجه به متن، کدام یک از عبارات زیر صحیح است؟,هیچ تلفات جانی نداشت,همه مهمانان از امارات متحده عربی بودند,مهمانان در روز قبل از زیارت حج آنجا بودند,اغلب مهمانان از محلی‌های مکه بودند,3,pes_Arab,2023-06-07
https://en.wikinews.org/wiki/Burning_debris_from_satellites_spotted_over_several_US_cities,1,این ماهواره‌ها که هر دو وزن‌شان بیش از 1000 پوند است و تقریباً با سرعت 17،500 مایل بر ساعت حرکت می‌کنند، 491 مایل بالاتر از سطح زمین با هم برخورد کردند. به گفته دانشمندان، انفجار ناشی از این برخورد بسیار گسترده بود. آنها هنوز در حال تعیین میزان بزرگی برخورد چگونگی تأثیرپذیری زمین از آن هستند. فرماندهی استراتژیک وزارت دفاع آمریكا در حال ردیابی مخروبه‌هاست. نتیجه تحلیل نقشه برداری بر روی یک وب سایت عمومی منتشر می‌شود.,با توجه به متن، چه اطلاعاتی درباره برخورد نامعلوم نیست؟,اندازه برخورد,موقعیت مکانی برخورد,اثر برخورد بر زمین,موقعیت مکانی مخروبه‌ها,2,pes_Arab,2023-06-07
https://en.wikinews.org/wiki/Burning_debris_from_satellites_spotted_over_several_US_cities,2,این ماهواره‌ها که هر دو وزن‌شان بیش از 1000 پوند است و تقریباً با سرعت 17،500 مایل بر ساعت حرکت می‌کنند، 491 مایل بالاتر از سطح زمین با هم برخورد کردند. به گفته دانشمندان، انفجار ناشی از این برخورد بسیار گسترده بود. آنها هنوز در حال تعیین میزان بزرگی برخورد چگونگی تأثیرپذیری زمین از آن هستند. فرماندهی استراتژیک وزارت دفاع آمریكا در حال ردیابی مخروبه‌هاست. نتیجه تحلیل نقشه برداری بر روی یک وب سایت عمومی منتشر می‌شود.,با توجه به متن، هنوز چه چیزی درباره برخورد باید مشخص شود؟,چه کسی ردیابی مخروبه‌ها را به عهده می‌گیرد,ماهواره‌ها در زمان برخورد با چه سرعتی حرکت می‌کردند,نتایج تحلیل نقشه‌برداری چگونه منتشر خواهد شد,مقیاس دقیق برخورد,4,pes_Arab,2023-06-07
https://en.wikinews.org/wiki/Businessman_and_founder_of_The_Weather_Channel_Frank_Batten_dies_at_82,1,«بَتن» در لیست 400 آمریکایی پولدار سال 2008 با داشتن سرمایه‌ای به ارزش تخمینی 2.3 میلیارد دلار، رتبه 190 را کسب کرد. او از کالج هنر و علوم دانشگاه ویرجینیا در سال 1950 فارغ‌التحصیل شد و یکی از خیرین مهم حامی آن مؤسسه بود.,بر اساس این متن، بَتن زمانی در فهرست ثروتمندترین آمریکایی‌ها چه جایگاهی داشت؟,400ام,20ام,190ام,23ام,3,pes_Arab,2023-06-07
https://en.wikinews.org/wiki/Businessman_and_founder_of_The_Weather_Channel_Frank_Batten_dies_at_82,2,«بَتن» در لیست 400 آمریکایی پولدار سال 2008 با داشتن سرمایه‌ای به ارزش تخمینی 2.3 میلیارد دلار، رتبه 190 را کسب کرد. او از کالج هنر و علوم دانشگاه ویرجینیا در سال 1950 فارغ‌التحصیل شد و یکی از خیرین مهم حامی آن مؤسسه بود.,بَتن به کدام یک از موارد زیر کمک مالی کرد؟,فهرست ثروتمندترین شهروندان آمریکا,دانشگاه ویرجینیا,تعداد قابل‌توجهی از مؤسسات,کالج‌هایی که وقف هنر و علوم بودند,2,pes_Arab,2023-06-07
https://en.wikinews.org/wiki/California_bans_sale_of_violent_video_games_to_minors,1,حکمران کالیفرنیا، آرنولد شوارتزنگر، لایحه‌ای به قانون افزود که فروش و اجاره بازی‌های ویدیویی خشن به افراد کم سن و سال ممنوع شود. این لایحه بازی های ویدئویی خشونت آمیز که در ایالت کالیفرنیا فروخته می شود را ملزم به نصب برچسب «18» می‌کند و برای تخلف در فروش آنها به افراد زیر سن قانونی جریمه 1000 دلاری تعیین می‌کند.,چه بخشی از لایحه توسط فرماندار آرنولد شوارتزنگر امضا نشده است؟,ممنوعیت فروش یا کرایه بازی‌های ویدئویی خشونت‌آمیز به خردسالان در سراسر کالیفرنیا,جریمه‌های نقدی برای متخلفین,ممنوعیت فروش یا اجاره بازی های ویدئویی خشونت آمیز به افراد زیر سن قانونی خارج از کالیفرنیا,الزام نصب برچسب روی بازی‌های خشن,3,pes_Arab,2023-06-07
https://en.wikinews.org/wiki/California_lawmaker_denies_affairs_after_sexual_discussion_becomes_public,1,دووال، که با داشتن دو فرزند بزرگسال، ازدواج کرده است، تأثیر زیادی بر میلر که داستان به وی مربوط می‌شود نگذاشت. هنگامی‌ که از میلر خواسته شد اظهارنظر کند گفت: «مایک در زمان دادرسی زیاد صحبت می‌کرد ... من داشتم آماده می‌شدم بنابراین واقعاً نمی‌شنیدم که چه می‌گوید.»,با توجه به متن، چه کسی متوجه چیزهایی که گفته می‌شد، نشده بود؟,فرزندان دووال,مایک,میلر,دووال,3,pes_Arab,2023-06-07
