link,question_number,flores_passage,question,mc_answer1,mc_answer2,mc_answer3,mc_answer4,correct_answer_num,dialect,ds
https://en.wikinews.org/wiki/Fossilized_remains_of_small_dinosaur_rediscovered_in_Canada,1,«هسپرونیکوس الیزابتا» گونه‌ای از تیره «دونده‌خزندگان» است و پسرعموی ولاسیراپتور است. اعتقاد می‌رفت این پرنده شکاری تمام‌پر و خون‌گرم صاف روی دوپایش راه می‌رفته و پنجه‌هایی شبیه ولاسیراپتور داشته است. پنجه دومش بزرگتر بود که سبب نام‌گذاری «Hesperonychus» به معنی «پنجه غربی» شد.,با توجه به متن، کدام ویژگی هسپرونیکوس را از ولاسیراپتور متمایز می‌کند؟,دو پا دارد,پنجه دوم بزرگتری دارد,بدنی کاملا پوشیده از پر دارد,خون‌گرم است,2,pes_Arab,2023-06-07
https://en.wikinews.org/wiki/Fossilized_remains_of_small_dinosaur_rediscovered_in_Canada,2,«هسپرونیکوس الیزابتا» گونه‌ای از تیره «دونده‌خزندگان» است و پسرعموی ولاسیراپتور است. اعتقاد می‌رفت این پرنده شکاری تمام‌پر و خون‌گرم صاف روی دوپایش راه می‌رفته و پنجه‌هایی شبیه ولاسیراپتور داشته است. پنجه دومش بزرگتر بود که سبب نام‌گذاری «Hesperonychus» به معنی «پنجه غربی» شد.,معنای «Hesperonychus» (هسپرونیکوس) از کدام ویژگی فیزیکی این گونه گرفته شده است؟,پنجه(ها),بدن پوشیده از پر,پاها,منقار,1,pes_Arab,2023-06-07
"https://en.wikinews.org/wiki/Four_killed,_four_others_injured_in_Buffalo,_New_York_shooting",1,حداقل 100 نفر در این مهمانی شرکت کرده بودند تا اولین سالگرد ازدواج زوجی را که پارسال عروسی‌شان برگزار شده بود جشن بگیرند. مقامات گفتند که یک رویداد رسمی برای سالگرد را در تاریخی برنامه‌ریزی شده است. این زوج سال گذشته در تگزاس ازدواج کرده بودند و برای جشن گرفتن در کنار دوستان و خانواده به «بوفالو» آمده بودند. شوهر 30 ساله که متولد شهر بوفالو است یکی از چهار کشته در تیراندازی بود، ولی همسرش آسیب ندید.,کدام یک از جملات زیر درباره تیراندازی صحیح است؟,زن و شوهر هر دو از تگزاس بودند,پنج قربانی در این تیراندازی وجود داشت,این زوج یک سال قبل در «بوفالو» ازدواج کرده بودند,تیراندازی در «بوفالو» رخ داد,4,pes_Arab,2023-06-07
"https://en.wikinews.org/wiki/Four_killed,_four_others_injured_in_Buffalo,_New_York_shooting",2,حداقل 100 نفر در این مهمانی شرکت کرده بودند تا اولین سالگرد ازدواج زوجی را که پارسال عروسی‌شان برگزار شده بود جشن بگیرند. مقامات گفتند که یک رویداد رسمی برای سالگرد را در تاریخی برنامه‌ریزی شده است. این زوج سال گذشته در تگزاس ازدواج کرده بودند و برای جشن گرفتن در کنار دوستان و خانواده به «بوفالو» آمده بودند. شوهر 30 ساله که متولد شهر بوفالو است یکی از چهار کشته در تیراندازی بود، ولی همسرش آسیب ندید.,کدام عبارت درباره رویداد تیراندازی صحیح است؟,در یک جشن سالگرد ازدواج در «بوفالو» رخ داد,در یک رویداد سالگرد رسمی اتفاق افتاد ,در جشنی در تگزاس اتفاق افتاد,در جشن عروسی زوج اتفاق افتاد ,1,pes_Arab,2023-06-07
https://en.wikinews.org/wiki/France_issues_pollution_alert_as_ship_splits_off_Basque_coast,1,لونو هنگام از کار افتادن، 120-160 متر مکعب سوخت داشت و باد و امواج مرتفع آن‌را به دورن موج‌شکن هل دادند. هلیکوپترها هر دوازده خدمه را نجات دادند و تنها جراحت شکستگی بینی یکی از آنها بود. کشتی 100 متری در مسیر بود تا طبق معمول بار کودش را بارگیری کند و مقامات رسمی در ابتدا می‌ترسیدند که بار از کشتی بیفتد.,با توجه به این متن، نگرانی اولیه مسئولان درباره لونو چه بود؟,کمبود بار کود,موج‌ها و بادهای شدید,نشت سوخت ,صدمه احتمالی به خدمه ,3,pes_Arab,2023-06-07
https://en.wikinews.org/wiki/France_issues_pollution_alert_as_ship_splits_off_Basque_coast,2,لونو هنگام از کار افتادن، 120-160 متر مکعب سوخت داشت و باد و امواج مرتفع آن‌را به دورن موج‌شکن هل دادند. هلیکوپترها هر دوازده خدمه را نجات دادند و تنها جراحت شکستگی بینی یکی از آنها بود. کشتی 100 متری در مسیر بود تا طبق معمول بار کودش را بارگیری کند و مقامات رسمی در ابتدا می‌ترسیدند که بار از کشتی بیفتد.,با توجه به این متن، کدام یک از جملات زیر درباره خرابی لونو صحیح نیست؟,از کار افتادگی پیش از بارگیری رخ داد,کشتی در زمان از کار افتادگی 100 متر سوخت داشت,از دوازده خدمه کشتی، یک نفر صدمه دید,کشتی به درون موج‌شکن هل داده شده بود,2,pes_Arab,2023-06-07
https://en.wikinews.org/wiki/French_campaigning_film_director_Ren%C3%A9_Vautier_dies,2,دست‌یافته‌های «ووتیه» غیر از کارگردانی شامل اعتصاب غذا در سال 1973 علیه چیزی است که آن را سانسور سیاسی می‌دانست. قانون فرانسه را عوض کردند. عمل‌گرایی او از 15 سالگی آغاز شد، یعنی وقتی طی دوره جنگ جهانی دوم به نهضت مقاومت فرانسه پیوست. او در یک کتاب چاپ سال 1998 درباره خودش نوشته است. در دهه 1960 به الجزایری که تازه استقلال یافته بود بازگشت و به تدریس کارگردانی پرداخت.,الجزایر در چه دهه‌ای استقلال پیدا کرد؟,دهه 1940,دهه 1950,دهه 1960,دهه 1970,3,pes_Arab,2023-06-07
https://en.wikinews.org/wiki/Funeral_of_Pope_John_Paul_II_takes_place,1,بیش از چهار میلیون نفر برای حضور در مراسم خاکسپاری به رم رفتند. تعداد افراد حاضر آنقدر زیاد بود که امکان دسترسی همه به مراسم خاکسپاری در میدان سنت پیتر ممکن نبود. چند نمایشگر تلویزیونی بزرگ در مکان‌های مختلف شهر رم نصب شدند تا مردم بتوانند مراسم را مشاهده کنند. در بسیاری از شهرهای ایتالیا و سایر نقاط جهان، به‌خصوص در لهستان، مجموعه‌های مشابهی ساخته شده که تعداد زیادی از مردم از آن بازدید کرده‌اند.,در کجا نمایشگر تلویزیونی برای مراسم خاکسپاری نصب نشده بود؟,سرتاسر رم,در شهرهای مختلف ایتالیا,در نقاط خاصی از لهستان,در میدان سنت پیتر,4,pes_Arab,2023-06-07
https://en.wikinews.org/wiki/Funeral_of_Pope_John_Paul_II_takes_place,2,بیش از چهار میلیون نفر برای حضور در مراسم خاکسپاری به رم رفتند. تعداد افراد حاضر آنقدر زیاد بود که امکان دسترسی همه به مراسم خاکسپاری در میدان سنت پیتر ممکن نبود. چند نمایشگر تلویزیونی بزرگ در مکان‌های مختلف شهر رم نصب شدند تا مردم بتوانند مراسم را مشاهده کنند. در بسیاری از شهرهای ایتالیا و سایر نقاط جهان، به‌خصوص در لهستان، مجموعه‌های مشابهی ساخته شده که تعداد زیادی از مردم از آن بازدید کرده‌اند.,مراسم خاکسپاری کجا برگزار شد؟,در میدان‌های مختلفی در سرتاسر رم,در لهستان,در میدان سنت پیتر,ابتدا در رم، سپس در شهر دیگری در ایتالیا,3,pes_Arab,2023-06-07
"https://en.wikinews.org/wiki/Gas_explosion_reported_in_Hammersmith,_London",1,براساس گزارش‌ها، یک آپارتمان در خیابان مکبث به دلیل نشت گاز منفجر شد. پس از آنكه يكی از همسایه‌ها درباره نشت گاز تماس گرفت، يكی از مقام‌های شركت گاز در محل رویداد در حال ارائه گزارش بود. وقتی مقام رسمی از راه رسید، آپارتمان منفجر شد. هیچ مصدومیت عمده ای گزارش نشده است، اما حداقل پنج نفر در زمان انفجار در آن صحنه به دلیل علائم شوک تحت درمان قرار گرفتند. هیچ کس در آپارتمان حضور نداشت. در آن موقع، تقریباً 100 نفر از ساکنان آن منطقه از آنجا بیرون برده شده بودند.,پس از انفجار، چه کسانی به دلیل جراحات جدی تحت درمان قرار گرفتند؟,حداقل پنج نفر,هیچکس,مقامی از شرکت گاز ,یک همسایه,2,pes_Arab,2023-06-07
"https://en.wikinews.org/wiki/Gas_explosion_reported_in_Hammersmith,_London",2,براساس گزارش‌ها، یک آپارتمان در خیابان مکبث به دلیل نشت گاز منفجر شد. پس از آنكه يكی از همسایه‌ها درباره نشت گاز تماس گرفت، يكی از مقام‌های شركت گاز در محل رویداد در حال ارائه گزارش بود. وقتی مقام رسمی از راه رسید، آپارتمان منفجر شد. هیچ مصدومیت عمده ای گزارش نشده است، اما حداقل پنج نفر در زمان انفجار در آن صحنه به دلیل علائم شوک تحت درمان قرار گرفتند. هیچ کس در آپارتمان حضور نداشت. در آن موقع، تقریباً 100 نفر از ساکنان آن منطقه از آنجا بیرون برده شده بودند.,چه کسی نشت گاز را گزارش داد؟,یکی از همسایگان در آپارتمان,فردی که در آپارتمان زندگی می‌کرد,از مقام‌های شرکت گاز,مدیر آپارتمان,1,pes_Arab,2023-06-07
https://en.wikinews.org/wiki/German_judge_orders_life_sentence_for_nation%27s_%27first_Islamic-motivated_terror_attack%27,1,تلفات آن عبارت بود از نیکلاس آلدن، 25 ساله، و زاخاری کادبک، 21 ساله. کادبک راننده بود. ادگار وگیلا از ناحیه دست و فک زخمی شد، و از آن طرف کریستوفر اشنایدر نیاز به جراحی ترمیمی صورت پیدا کرد. سلاح اوکا در حالی که سر مرد پنجم را نشانه رفته بود، عمل نکرد. اشنایدر درد مداوم داشت از ناحیه یک چشم کور بود، بخشی از جمجمه اش از دست رفته بود و چهره اش با تیتانیوم بازسازی شده بود. اشنایدر از طریق لینک ویدئویی از پایگاه نیروی هوایی ایالات متحده در کشورش شهادت داد.,با توجه به متن، چند نفر در این حمله فوت کردند؟,4,2,5,2,2,pes_Arab,2023-06-07
https://en.wikinews.org/wiki/German_judge_orders_life_sentence_for_nation%27s_%27first_Islamic-motivated_terror_attack%27,2,تلفات آن عبارت بود از نیکلاس آلدن، 25 ساله، و زاخاری کادبک، 21 ساله. کادبک راننده بود. ادگار وگیلا از ناحیه دست و فک زخمی شد، و از آن طرف کریستوفر اشنایدر نیاز به جراحی ترمیمی صورت پیدا کرد. سلاح اوکا در حالی که سر مرد پنجم را نشانه رفته بود، عمل نکرد. اشنایدر درد مداوم داشت از ناحیه یک چشم کور بود، بخشی از جمجمه اش از دست رفته بود و چهره اش با تیتانیوم بازسازی شده بود. اشنایدر از طریق لینک ویدئویی از پایگاه نیروی هوایی ایالات متحده در کشورش شهادت داد.,سلاح چه کسی هنگام نشانه‌گیری در زمان حمله عمل نکرد؟,کادبک ,اوکا,اشنایدر,آلدن,2,pes_Arab,2023-06-07
https://en.wikinews.org/wiki/Golf_and_rugby_set_to_return_to_the_Olympic_Games,1,قرار است گلف و راگبی هر دو به بازی های المپیک بازگردند. کمیته بین‌المللی المپیک رأیی صادر کرد مبنی بر اینکه ورزش‌ها در جلسه هیئت اجرایی امروز برلین گنجانده شود. راگبی، بخصوص راگبی یونیون، و گلف از بین پنج ورزش دیگر انتخاب شدند تا ورود آنها به المپیک مورد بررسی قرار گیرد. اسکواش، کاراته و ورزش‌های غلتان سعی کردند وارد برنامه المپیک شوند همانند بیس بال و سافت بالکه در سال 2005 از بازی های المپیک کنار گذاشته شدند. رأی هنوز باید توسط تمام اعضای کمیته بین‌المللی المپیک (IOC) در جلسه ماه اکتبر آن در کپنهاگ تصویب شود.,کدام یک از ورزش‌های زیر با رأی از برنامه المپیک کنار گذاشته شدند؟,اسکواش,راگبی,بیس بال,کاراته,3,pes_Arab,2023-06-07
https://en.wikinews.org/wiki/Golf_and_rugby_set_to_return_to_the_Olympic_Games,2,قرار است گلف و راگبی هر دو به بازی های المپیک بازگردند. کمیته بین‌المللی المپیک رأیی صادر کرد مبنی بر اینکه ورزش‌ها در جلسه هیئت اجرایی امروز برلین گنجانده شود. راگبی، بخصوص راگبی یونیون، و گلف از بین پنج ورزش دیگر انتخاب شدند تا ورود آنها به المپیک مورد بررسی قرار گیرد. اسکواش، کاراته و ورزش‌های غلتان سعی کردند وارد برنامه المپیک شوند همانند بیس بال و سافت بالکه در سال 2005 از بازی های المپیک کنار گذاشته شدند. رأی هنوز باید توسط تمام اعضای کمیته بین‌المللی المپیک (IOC) در جلسه ماه اکتبر آن در کپنهاگ تصویب شود.,کمیته بین‌المللی المپیک برای گنجاندن کدام یک از ورزش‌های زیر رأی داد؟,ورزش‌های غلتان,بیس بال,اتحادیه راگبی,سافتبال,3,pes_Arab,2023-06-07
https://en.wikinews.org/wiki/Guinness_turns_250,1,در 24 سپتامبر 1759، آرتور گینس اجاره‌نامه‌ای 9000 ساله را برای آبجوسازی گیت در خیابان سنت جیمز در دوبلین، ایرلند امضاء کرد. 250 سال بعد، گینس به تجارتی جهانی رشد یافته است که هرسال بیش از 10 میلیارد یورو (14.7 میلیارد دلار آمریکا) آورده دارد.,آرتور گینس در ابتدا کارخانه آبجوسازی سنت جیمز گیت را برای چند سال اجاره کرد؟,250,10,1759,9000,4,pes_Arab,2023-06-07
https://en.wikinews.org/wiki/Guinness_turns_250,2,در 24 سپتامبر 1759، آرتور گینس اجاره‌نامه‌ای 9000 ساله را برای آبجوسازی گیت در خیابان سنت جیمز در دوبلین، ایرلند امضاء کرد. 250 سال بعد، گینس به تجارتی جهانی رشد یافته است که هرسال بیش از 10 میلیارد یورو (14.7 میلیارد دلار آمریکا) آورده دارد.,گینس هر ساله حدوداً چند دلار آورده داشت؟,9,250,14,10,3,pes_Arab,2023-06-07
https://en.wikinews.org/wiki/H5N1_confirmed_in_France,1,H5N1 سویه کشنده آنفلوانزای مرغی است که به انسان منتقل می‌شود، و تایید شده اردک وحشی که روز دوشنبه تلف شده و در باتلاقی در نزدیکی لیون در شرق فرانسه پیدا شده، به آن مبتلا بوده است. فرانسه هفتمین کشور در اتحادیه اروپا است که بدلیل این ویروس به دردسر افتاده است؛ این کشور بعد از اتریش، آلمان، اسلوونی، بلغارستان، یونان و ایتالیا قرار دارد. موارد مشکوک به H5N1 در کرواسی و دانمارک هنوز تأیید نشده است.,ویروس H5N1 در چند کشور اتحادیه اروپا شناسایی شده است؟,پنج,شش,هفت,هشت,3,pes_Arab,2023-06-07
https://en.wikinews.org/wiki/H5N1_confirmed_in_France,2,H5N1 سویه کشنده آنفلوانزای مرغی است که به انسان منتقل می‌شود، و تایید شده اردک وحشی که روز دوشنبه تلف شده و در باتلاقی در نزدیکی لیون در شرق فرانسه پیدا شده، به آن مبتلا بوده است. فرانسه هفتمین کشور در اتحادیه اروپا است که بدلیل این ویروس به دردسر افتاده است؛ این کشور بعد از اتریش، آلمان، اسلوونی، بلغارستان، یونان و ایتالیا قرار دارد. موارد مشکوک به H5N1 در کرواسی و دانمارک هنوز تأیید نشده است.,جدیدترین مورد از ویروس H5N1 شناسایی‌شده کجا بود؟,فرانسه,آلمان,دانمارک,یونان,1,pes_Arab,2023-06-07
https://en.wikinews.org/wiki/Haitian_cholera_victims_threaten_United_Nations_with_lawsuit,1,محافظان صلح سازمان ملل که پس از زلزله سال 2010 رسیدند، بخاطر شیوع بیماری که نزدیک اردوگاه نیروها شروع شد مورد سرزنش قرار می‌گیرند. براساس این دادخواست، پسماندهای اردوگاه سازمان ملل به درستی و مطابق اصول بهداشتی دفع نشده و باعث ورود باکتری‌ها به داخل یکی از سرشاخه‌های رودخانه آرتیبونیت، از بزرگترین رودخانه‌های هائیتی شده است. قبل از رسیدن نیروها، هائیتی از دهه 1800 با مشکلات مربوط به این بیماری روبرو نبود. بنیاد عدالت و دموکراسی هائیتی مطالعات مستقلی را ارجاع داده‌اند که نشان می‌دهد گردان نپالی محافظان صلح سازمان ملل ناآگاهانه این بیماری را به هائیتی آورده‌اند. «danielle Lantagne»، کارشناس سازمان ملل متحد در زمینه این بیماری، اظهار داشت احتمال می‌رود حافظان صلح باعث شیوع بیماری شده باشند.,آخرین رویارویی هائیتی با این بیماری قبل از شیوع این بیماری توسط محافظان صلح چه زمانی بود؟,دهه 1800,کمی پیش از رسیدن ارتش‌ها,پیش از زمین‌لرزه,در سال 2009,1,pes_Arab,2023-06-07
https://en.wikinews.org/wiki/Haitian_cholera_victims_threaten_United_Nations_with_lawsuit,2,محافظان صلح سازمان ملل که پس از زلزله سال 2010 رسیدند، بخاطر شیوع بیماری که نزدیک اردوگاه نیروها شروع شد مورد سرزنش قرار می‌گیرند. براساس این دادخواست، پسماندهای اردوگاه سازمان ملل به درستی و مطابق اصول بهداشتی دفع نشده و باعث ورود باکتری‌ها به داخل یکی از سرشاخه‌های رودخانه آرتیبونیت، از بزرگترین رودخانه‌های هائیتی شده است. قبل از رسیدن نیروها، هائیتی از دهه 1800 با مشکلات مربوط به این بیماری روبرو نبود. بنیاد عدالت و دموکراسی هائیتی مطالعات مستقلی را ارجاع داده‌اند که نشان می‌دهد گردان نپالی محافظان صلح سازمان ملل ناآگاهانه این بیماری را به هائیتی آورده‌اند. «danielle Lantagne»، کارشناس سازمان ملل متحد در زمینه این بیماری، اظهار داشت احتمال می‌رود حافظان صلح باعث شیوع بیماری شده باشند.,زباله ناشی از کدام محل در گسترش بیماری نقش داشته است؟,رودخانه آرتیبونیت,اردوگاه سازمان ملل,محل زلزله 2010,بنیاد عدالت و دموکراسی هائیتی,2,pes_Arab,2023-06-07
https://en.wikinews.org/wiki/Hard_drugs_temporarily_legal_in_Ireland_due_to_constitutional_loophole,1,دولت ایرلند بر فوریت قانون‌گذاری پارلمان در جهت اصلاح اوضاع تأکید دارد. سخنگوی دولت اعلام کرد، «از هر دو منظر بهداشت عمومی و دیدگاه عدالت کیفری مهم این است كه این قانون در اسرع وقت تصویب شود.» وزیر بهداشت هم برای رفاه افرادی که از مزایای قانونی بودن موقت مواد مربوطه استفاده می‌کنند و هم برای محکومیت‌های مربوط به مواد مخدر که از زمان اعمال تغییرات غیراساسی صادر شده است، ابراز نگرانی کرد.,دولت ایرلند درحال برنامه‌ریزی برای چه چیزی است؟,صدور محکومیت برای مجرمان مواد مخدر,تصویب قوانینی سخت‌گیرانه‌تر پیرامون مجاز بودن مواد,تخفیف قوانین درباره مجاز بودن مواد,جرم‌زدایی از مواد مخدر,2,pes_Arab,2023-06-07
https://en.wikinews.org/wiki/Hard_drugs_temporarily_legal_in_Ireland_due_to_constitutional_loophole,2,دولت ایرلند بر فوریت قانون‌گذاری پارلمان در جهت اصلاح اوضاع تأکید دارد. سخنگوی دولت اعلام کرد، «از هر دو منظر بهداشت عمومی و دیدگاه عدالت کیفری مهم این است كه این قانون در اسرع وقت تصویب شود.» وزیر بهداشت هم برای رفاه افرادی که از مزایای قانونی بودن موقت مواد مربوطه استفاده می‌کنند و هم برای محکومیت‌های مربوط به مواد مخدر که از زمان اعمال تغییرات غیراساسی صادر شده است، ابراز نگرانی کرد.,چه چیزی در ایرلند به طور موقت مجاز بود؟,دزدی,کلاهبرداری,حمله,مواد,4,pes_Arab,2023-06-07
https://en.wikinews.org/wiki/Hollywood_sign_modified_to_read_%27Hollyweed%27,1,کریستوفر گارسیا، یک سخنگوی اداره پلیس لس‌آنجلس گفت: این فرد مذکر که مظنون ارتکاب جرم است، به‌جای خرابکاری، برای تجاوز تحت بازجویی است. نشانه به لحاظ فیزیکی آسیب ندید؛ این تغییر با استفاده از پارچه‌های برزنتی سیاه مزین به نشانه‌های صلح و قلب برای تغییر «O» انجام شد تا حرف کوچک «e» خوانده شود.,متهم مظنون به چه دلیل تحت بازجویی قرار دارد؟,تجاوز,آسیب فیزیکی,خرابکاری,دزدی,1,pes_Arab,2023-06-07
